"Status","Start Time","Stop Time","Duration in ms","Parent Suite","Suite","Sub Suite","Test Class","Test Method","Name","Description"
"passed","Fri Dec 05 13:12:05 UTC 2025","Fri Dec 05 13:12:16 UTC 2025","10354","","Fotocasa: Búsqueda de Ciudad (Test Base)","","","","Debe buscar la ciudad de Madrid, cargar los resultados y verificar el título",""
"passed","Fri Dec 05 13:11:10 UTC 2025","Fri Dec 05 13:11:13 UTC 2025","3223","","Tests de Home Page Fotocasa","","","","Debe cargar la página principal correctamente",""
"passed","Fri Dec 05 13:11:51 UTC 2025","Fri Dec 05 13:12:02 UTC 2025","11767","","Fotocasa: Filtro de Precio Mínimo","","","","Debe aplicar un filtro de precio mínimo y validar que todos los resultados cumplen",""
"passed","Fri Dec 05 13:10:53 UTC 2025","Fri Dec 05 13:11:07 UTC 2025","14196","","Fotocasa: Aplicación de Múltiples Filtros Avanzados","","","","Debe aplicar filtros: Distrito, Alquiler, Larga Duración y Ascensor",""
"failed","Fri Dec 05 13:11:40 UTC 2025","Fri Dec 05 13:11:48 UTC 2025","8580","","Fotocasa: Navegación a Detalle de Inmueble","","","","Debe buscar en Madrid y abrir el detalle del primer resultado",""
"failed","Fri Dec 05 13:11:15 UTC 2025","Fri Dec 05 13:11:36 UTC 2025","21087","","Fotocasa: Navegación de Paginación","","","","Debe navegar a la página 2 y verificar que es la página activa",""
